{
  "artifact_id": "dpt-standard-worker",
  "kind": "dual_process_theory",
  "name": "Standard Worker Cognitive Routing",
  "version": "1.1.0",
  "lifecycle_state": "active",
  "owner_ref": "platform-engineering",
  "environment": "prod",
  "spec": {
    "default_pathway": {
      "optimization_target": "latency",
      "allowed_heuristics": ["trust_public_cache_blindly", "use_smaller_model"]
    },
    "engagement_triggers": {
      "goal_alignment_threshold": 0.8,
      "curiosity_override": false,
      "critical_failure_risk": 0.6
    },
    "deep_pathway": {
      "optimization_target": "accuracy",
      "mandatory_routines": ["active_probing", "multi_source_verification"]
    }
  }
}
